{
  "alpha": null,
  "asset_id": "relict_autotile_grassdungeon5_19fbf982450e",
  "classification": "INCLUDED_ENVIRONMENTAL",
  "dependencies": [],
  "dimensions": {
    "height_px": 128,
    "width_px": 576
  },
  "game_id": "relict",
  "kind": "AUTOTILE",
  "problems": [],
  "provenance": {
    "commit": "6963878956ec4c53833c03f26aa6a9aafd17800f",
    "extraction_method": "bounded pure-Python Ruby Marshal 4.8 reader; no source code execution",
    "license_status": "UNKNOWN",
    "repository": "https://github.com/meromoonmeri/BIBLIOTHEQUE",
    "sha256": "19fbf982450edf0304318785d7116788906142c11203c3c5b8ebf8af1170affa",
    "size_bytes": 9261,
    "source_format": "png",
    "source_path": "Relict/Relict V1.2/Relict/Graphics/Autotiles/grassDungeon5.png"
  },
  "schema_version": "1.0.0",
  "status": "SOURCE_EXTRACTED",
  "used_by_zones": [
    "relict_map_003:variant:mies_conflicted_copy_2026_01_01",
    "relict_map_005:variant:mies_conflicted_copy_2026_01_01",
    "relict_map_006:variant:mies_conflicted_copy_2026_01_01"
  ]
}
